ID;TITLE;LINK
47001;"De Officiis by Marcus Tullius Cicero (74)";https://www.gutenberg.org/ebooks/47001
2981;"The Memoirs of Jacques Casanova de Seingalt, 1725-1798. Complete by Giacomo Casanova (74)";https://www.gutenberg.org/ebooks/2981
40505;"Scurvy, Past and Present by Alfred F. Hess (74)";https://www.gutenberg.org/ebooks/40505
30658;"Kamerplanten: Handboek tot het kweeken van planten in de kamer by Max Hesdörffer (73)";https://www.gutenberg.org/ebooks/30658
37734;"Some Jewish Witnesses For Christ by Aaron Bernstein (73)";https://www.gutenberg.org/ebooks/37734
14155;"Madame Bovary by Gustave Flaubert (73)";https://www.gutenberg.org/ebooks/14155
9182;"Villette by Charlotte Brontë (73)";https://www.gutenberg.org/ebooks/9182
8954;"Lady Audley's Secret by M. E.  Braddon (73)";https://www.gutenberg.org/ebooks/8954
15210;"Darkwater: Voices from Within the Veil by W. E. B.  Du Bois (73)";https://www.gutenberg.org/ebooks/15210
21000;"Faust: Eine Tragödie [erster Teil] by Johann Wolfgang von Goethe (73)";https://www.gutenberg.org/ebooks/21000
8525;"Eve's Diary, Complete by Mark Twain (73)";https://www.gutenberg.org/ebooks/8525
981;"Beowulf (72)";https://www.gutenberg.org/ebooks/981
2383;"The Canterbury Tales, and Other Poems by Geoffrey Chaucer (72)";https://www.gutenberg.org/ebooks/2383
22994;"The Frontier in American History by Frederick Jackson Turner (72)";https://www.gutenberg.org/ebooks/22994
421;"Kidnapped by Robert Louis Stevenson (72)";https://www.gutenberg.org/ebooks/421
575;"The Essays or Counsels, Civil and Moral by Francis Bacon (71)";https://www.gutenberg.org/ebooks/575
1081;"Dead Souls by Nikolai Vasilevich Gogol (71)";https://www.gutenberg.org/ebooks/1081
45524;"The Open Boat and Other Stories by Stephen Crane (71)";https://www.gutenberg.org/ebooks/45524
4081;"The Alchemist by Ben Jonson (71)";https://www.gutenberg.org/ebooks/4081
969;"The Tenant of Wildfell Hall by Anne Brontë (71)";https://www.gutenberg.org/ebooks/969
2376;"Up from Slavery: An Autobiography by Booker T. Washington (71)";https://www.gutenberg.org/ebooks/2376
54027;"Nil Darpan; or, The Indigo Planting Mirror, A Drama. by Dinabandhu Mitra (71)";https://www.gutenberg.org/ebooks/54027
25716;"灵历集光 by Shangjie Song (71)";https://www.gutenberg.org/ebooks/25716
16269;"Thought-Forms by Annie Besant and C. W.  Leadbeater (71)";https://www.gutenberg.org/ebooks/16269
32689;"Encyclopaedia Britannica, 11th Edition, "Dinard" to "Dodsworth, Roger" by Various (71)";https://www.gutenberg.org/ebooks/32689
25719;"The Privateer's-Man, One hundred Years Ago by Frederick Marryat (71)";https://www.gutenberg.org/ebooks/25719
5669;"Considerations on Representative Government by John Stuart Mill (70)";https://www.gutenberg.org/ebooks/5669
4583;"Dialogues Concerning Natural Religion by David Hume (70)";https://www.gutenberg.org/ebooks/4583
32032;"Second Variety by Philip K. Dick (70)";https://www.gutenberg.org/ebooks/32032
39742;"Half a Man: The Status of the Negro in New York by Mary White Ovington (70)";https://www.gutenberg.org/ebooks/39742
1719;"The Ballad of the White Horse by G. K.  Chesterton (70)";https://www.gutenberg.org/ebooks/1719
8809;"Aesop's Fables by Aesop (70)";https://www.gutenberg.org/ebooks/8809
5402;"1811 Dictionary of the Vulgar Tongue by Francis Grose (70)";https://www.gutenberg.org/ebooks/5402
13707;"Twice-told tales by Nathaniel Hawthorne (70)";https://www.gutenberg.org/ebooks/13707
39452;"The Pilgrim's Progress by John Bunyan Every Child Can Read by John Bunyan (70)";https://www.gutenberg.org/ebooks/39452
376;"A Journal of the Plague Year by Daniel Defoe (70)";https://www.gutenberg.org/ebooks/376
48438;"Rizal's own story of his life by José Rizal (70)";https://www.gutenberg.org/ebooks/48438
22976;"Slave Narratives: A Folk History of Slavery in the United States from Interviews with Former Slaves, (70)";https://www.gutenberg.org/ebooks/22976
10947;"The Best American Humorous Short Stories (69)";https://www.gutenberg.org/ebooks/10947
3618;"Arms and the Man by Bernard Shaw (69)";https://www.gutenberg.org/ebooks/3618
74783;"Boynton bicycle railway system (69)";https://www.gutenberg.org/ebooks/74783
17116;"Ang Liham ni Dr. Jose Rizal sa mga Kadalagahan sa Malolos, Bulakan by José Rizal (69)";https://www.gutenberg.org/ebooks/17116
38769;"A Course of Pure Mathematics by G. H.  Hardy (69)";https://www.gutenberg.org/ebooks/38769
31270;"The Writings of Thomas Paine, Complete by Thomas Paine (69)";https://www.gutenberg.org/ebooks/31270
80;"The Online World by Odd De Presno (69)";https://www.gutenberg.org/ebooks/80
14988;"Cicero's Tusculan Disputations by Marcus Tullius Cicero (69)";https://www.gutenberg.org/ebooks/14988
2559;"The Forsyte Saga, Volume I. by John Galsworthy (69)";https://www.gutenberg.org/ebooks/2559
21829;"A Treatise on Domestic Economy; For the Use of Young Ladies at Home and at School by Beecher (69)";https://www.gutenberg.org/ebooks/21829
2009;"The Origin of Species by Means of Natural Selection by Charles Darwin (69)";https://www.gutenberg.org/ebooks/2009
62940;"Mrs. Spring Fragrance by Sui Sin Far (68)";https://www.gutenberg.org/ebooks/62940
1450;"Pollyanna by Eleanor H.  Porter (68)";https://www.gutenberg.org/ebooks/1450
657;"The Anglo-Saxon Chronicle (68)";https://www.gutenberg.org/ebooks/657
28593;"When dreams come true by Ritter Brown (68)";https://www.gutenberg.org/ebooks/28593
5683;"The Critique of Practical Reason by Immanuel Kant (67)";https://www.gutenberg.org/ebooks/5683
23962;"西遊記 by Cheng'en Wu (67)";https://www.gutenberg.org/ebooks/23962
246;"The Rubaiyat of Omar Khayyam by Omar Khayyam (67)";https://www.gutenberg.org/ebooks/246
50307;"Fifteen sonnets of Petrarch by Francesco Petrarca (67)";https://www.gutenberg.org/ebooks/50307
1929;"The School for Scandal by Richard Brinsley Sheridan (67)";https://www.gutenberg.org/ebooks/1929
26487;"Little Lucy's Wonderful Globe by Charlotte M.  Yonge (67)";https://www.gutenberg.org/ebooks/26487
222;"The Moon and Sixpence by W. Somerset  Maugham (67)";https://www.gutenberg.org/ebooks/222
1508;"The Taming of the Shrew by William Shakespeare (67)";https://www.gutenberg.org/ebooks/1508
15859;"The Piazza Tales by Herman Melville (67)";https://www.gutenberg.org/ebooks/15859
14033;"Plutarch's Lives, Volume 1 (of 4) by Plutarch (66)";https://www.gutenberg.org/ebooks/14033
74770;"The greatest story in the world, period 1 (of 3) : by Horace G.  Hutchinson (66)";https://www.gutenberg.org/ebooks/74770
74780;"The illustrious Dr. Mathéus by Erckmann-Chatrian (66)";https://www.gutenberg.org/ebooks/74780
66057;"The Tale of Genji by Murasaki Shikibu (66)";https://www.gutenberg.org/ebooks/66057
1549;"Commentary on the Epistle to the Galatians by Martin Luther (66)";https://www.gutenberg.org/ebooks/1549
47287;"El libro de las mil noches y una noche; t. 1 by Anonymous (66)";https://www.gutenberg.org/ebooks/47287
1;"The Declaration of Independence of the United States of America by Thomas Jefferson (66)";https://www.gutenberg.org/ebooks/1
38427;"The World as Will and Idea (Vol. 1 of 3) by Arthur Schopenhauer (66)";https://www.gutenberg.org/ebooks/38427
25525;"The Works of Edgar Allan Poe, The Raven Edition by Edgar Allan Poe (66)";https://www.gutenberg.org/ebooks/25525
16317;"The Art of Public Speaking by Dale Carnegie and J. Berg  Esenwein (65)";https://www.gutenberg.org/ebooks/16317
52914;"The Will to Power: An Attempted Transvaluation of All Values. Book I and II by Nietzsche (65)";https://www.gutenberg.org/ebooks/52914
35690;"Omens and Superstitions of Southern India by Edgar Thurston (65)";https://www.gutenberg.org/ebooks/35690
17405;"The Art of War by active 6th century B.C. Sunzi (65)";https://www.gutenberg.org/ebooks/17405
389;"The Great God Pan by Arthur Machen (65)";https://www.gutenberg.org/ebooks/389
3913;"The Confessions of Jean Jacques Rousseau — Complete by Jean-Jacques Rousseau (65)";https://www.gutenberg.org/ebooks/3913
1254;"Cyrano de Bergerac by Edmond Rostand (65)";https://www.gutenberg.org/ebooks/1254
1171;"The Apology by Xenophon (65)";https://www.gutenberg.org/ebooks/1171
2490;"Lamia by John Keats (65)";https://www.gutenberg.org/ebooks/2490
1572;"Timaeus by Plato (65)";https://www.gutenberg.org/ebooks/1572
33870;"Chess Fundamentals by José Raúl Capablanca (65)";https://www.gutenberg.org/ebooks/33870
6523;"The Post Office by Rabindranath Tagore (65)";https://www.gutenberg.org/ebooks/6523
10148;"The Merry Adventures of Robin Hood by Howard Pyle (65)";https://www.gutenberg.org/ebooks/10148
14209;"The Kybalion by Three Initiates (65)";https://www.gutenberg.org/ebooks/14209
2833;"The Portrait of a Lady — Volume 1 by Henry James (65)";https://www.gutenberg.org/ebooks/2833
6043;"The Spanish Tragedie by Thomas Kyd (64)";https://www.gutenberg.org/ebooks/6043
1532;"The Tragedy of King Lear by William Shakespeare (64)";https://www.gutenberg.org/ebooks/1532
52484;"Le avventure di Pinocchio: Storia di un burattino by Carlo Collodi (64)";https://www.gutenberg.org/ebooks/52484
74767;"That worlds may live by Nelson S. Bond (64)";https://www.gutenberg.org/ebooks/74767
1280;"Spoon River Anthology by Edgar Lee Masters (64)";https://www.gutenberg.org/ebooks/1280
940;"The Last of the Mohicans; A narrative of 1757 by James Fenimore Cooper (64)";https://www.gutenberg.org/ebooks/940
2048;"The Sketch-Book of Geoffrey Crayon by Washington Irving (64)";https://www.gutenberg.org/ebooks/2048
45858;"Lucian's True History by of Samosata Lucian (63)";https://www.gutenberg.org/ebooks/45858
46032;"Vitus Bering: the Discoverer of Bering Strait by Peter Lauridsen (63)";https://www.gutenberg.org/ebooks/46032
28091;"The Double Four by E. Phillips  Oppenheim (63)";https://www.gutenberg.org/ebooks/28091
8642;"Woman in the Nineteenth Century by Margaret Fuller (63)";https://www.gutenberg.org/ebooks/8642
58025;"Index of the Project Gutenberg Works of Friedrich Nietzsche by Friedrich Wilhelm Nietzsche (63)";https://www.gutenberg.org/ebooks/58025
52881;"The Joyful Wisdom ("La Gaya Scienza") by Friedrich Wilhelm Nietzsche (63)";https://www.gutenberg.org/ebooks/52881
45634;"Myths of the Cherokee by James Mooney (63)";https://www.gutenberg.org/ebooks/45634
46559;"Travels in the Central Parts of Indo-China (Siam), Cambodia, and Laos (Vol. 1 of 2) by Henri Mouhot (63)";https://www.gutenberg.org/ebooks/46559
59058;"Aristotle's History of Animals by Aristotle (63)";https://www.gutenberg.org/ebooks/59058
66923;"West African Folk-Tales (63)";https://www.gutenberg.org/ebooks/66923
41085;"The New Life (La Vita Nuova) by Dante Alighieri (63)";https://www.gutenberg.org/ebooks/41085
50603;"Minute Mysteries [Detectograms] by H. A.  Ripley (63)";https://www.gutenberg.org/ebooks/50603
2944;"Essays — First Series by Ralph Waldo Emerson (63)";https://www.gutenberg.org/ebooks/2944
16751;"McGuffey's Sixth Eclectic Reader by William Holmes McGuffey (63)";https://www.gutenberg.org/ebooks/16751
1321;"The Waste Land by T. S.  Eliot (62)";https://www.gutenberg.org/ebooks/1321
38015;"De Re Metallica, Translated from the First Latin Edition of 1556 by Georg Agricola (62)";https://www.gutenberg.org/ebooks/38015
19179;"Kelly Miller's History of the World War for Human Rights by Kelly Miller (62)";https://www.gutenberg.org/ebooks/19179
131;"The Pilgrim's Progress from this world to that which is to come by John Bunyan (62)";https://www.gutenberg.org/ebooks/131
30107;"Principles of Political Economy by John Stuart Mill (62)";https://www.gutenberg.org/ebooks/30107
33144;"The Oriental Rug by William De Lancey Ellwanger (62)";https://www.gutenberg.org/ebooks/33144
10741;"The Essays of Arthur Schopenhauer: the Wisdom of Life by Arthur Schopenhauer (62)";https://www.gutenberg.org/ebooks/10741
675;"American Notes by Charles Dickens (62)";https://www.gutenberg.org/ebooks/675
51233;"The Marching Morons by C. M.  Kornbluth (62)";https://www.gutenberg.org/ebooks/51233
60093;"Cane by Jean Toomer (62)";https://www.gutenberg.org/ebooks/60093
155;"The Moonstone by Wilkie Collins (62)";https://www.gutenberg.org/ebooks/155
1695;"The Man Who Was Thursday: A Nightmare by G. K.  Chesterton (62)";https://www.gutenberg.org/ebooks/1695
3177;"Roughing It by Mark Twain (61)";https://www.gutenberg.org/ebooks/3177
9334;"The Spectator, Volume 1 by Joseph Addison and Sir Richard Steele (61)";https://www.gutenberg.org/ebooks/9334
52006;"Les liaisons dangereuses by Choderlos de Laclos (61)";https://www.gutenberg.org/ebooks/52006
74782;"The fate of Fenella : (61)";https://www.gutenberg.org/ebooks/74782
986;"Master and Man by graf Leo Tolstoy (61)";https://www.gutenberg.org/ebooks/986
32474;"The Memoirs of the Conquistador Bernal Diaz del Castillo, Vol 1 (of 2) by Bernal Díaz del Castillo (61)";https://www.gutenberg.org/ebooks/32474
17957;"On the Sublime by active 1st century Longinus (61)";https://www.gutenberg.org/ebooks/17957
16452;"The Iliad of Homer by Homer (60)";https://www.gutenberg.org/ebooks/16452
73144;"Lady Chatterley's lover by D. H.  Lawrence (60)";https://www.gutenberg.org/ebooks/73144
9700;"I. Beówulf: an Anglo-Saxon poem. II. The fight at Finnsburh: a fragment. (60)";https://www.gutenberg.org/ebooks/9700
1093;"The Beast in the Jungle by Henry James (60)";https://www.gutenberg.org/ebooks/1093
3623;"The Golden Bough: A Study of Magic and Religion by James George Frazer (60)";https://www.gutenberg.org/ebooks/3623
32940;"Encyclopaedia Britannica, 11th Edition, "England" to "English Finance" by Various (60)";https://www.gutenberg.org/ebooks/32940
30368;"A Christmas Carol by Charles Dickens (60)";https://www.gutenberg.org/ebooks/30368
2229;"Faust: Der Tragödie erster Teil by Johann Wolfgang von Goethe (60)";https://www.gutenberg.org/ebooks/2229
24113;"九命奇冤 by Jianren Wu (60)";https://www.gutenberg.org/ebooks/24113
6081;"Biographia Literaria by Samuel Taylor Coleridge (60)";https://www.gutenberg.org/ebooks/6081
1430;"Beautiful Stories from Shakespeare by E.  Nesbit and William Shakespeare (60)";https://www.gutenberg.org/ebooks/1430
7321;"The Nibelungenlied (60)";https://www.gutenberg.org/ebooks/7321
31591;"Language of Flowers by Kate Greenaway (60)";https://www.gutenberg.org/ebooks/31591
28556;"History of Woman Suffrage, Volume III (60)";https://www.gutenberg.org/ebooks/28556
38594;"Poems by Rainer Maria Rilke (59)";https://www.gutenberg.org/ebooks/38594
17851;"The History of Mary Prince, a West Indian Slave by Mary Prince (59)";https://www.gutenberg.org/ebooks/17851
57421;"Rockets, Missiles, and Spacecraft of the National Air and Space Museum, Smithsonian Institution (59)";https://www.gutenberg.org/ebooks/57421
503;"The Blue Fairy Book by Andrew Lang (59)";https://www.gutenberg.org/ebooks/503
798;"Le rouge et le noir: chronique du XIXe siècle by Stendhal (59)";https://www.gutenberg.org/ebooks/798
48612;"Psychological Warfare by Paul Myron Anthony Linebarger (59)";https://www.gutenberg.org/ebooks/48612
782;"The Travels of Sir John Mandeville by Sir John Mandeville (59)";https://www.gutenberg.org/ebooks/782
2197;"The Gambler by Fyodor Dostoyevsky (59)";https://www.gutenberg.org/ebooks/2197
23108;"Chester Rand; or, The New Path to Fortune by Jr. Horatio Alger (59)";https://www.gutenberg.org/ebooks/23108
26460;"English Fairy Tales by Joseph Jacobs (59)";https://www.gutenberg.org/ebooks/26460
102;"The Tragedy of Pudd'nhead Wilson by Mark Twain (59)";https://www.gutenberg.org/ebooks/102
8147;"The Man Who Would Be King by Rudyard Kipling (59)";https://www.gutenberg.org/ebooks/8147
201;"Flatland: A Romance of Many Dimensions by Edwin Abbott Abbott (58)";https://www.gutenberg.org/ebooks/201
62;"A Princess of Mars by Edgar Rice Burroughs (58)";https://www.gutenberg.org/ebooks/62
35347;"The Grand Canyon of Arizona: How to See It by George Wharton James (58)";https://www.gutenberg.org/ebooks/35347
3250;"How to Tell a Story, and Other Essays by Mark Twain (58)";https://www.gutenberg.org/ebooks/3250
1906;"Erewhon; Or, Over the Range by Samuel Butler (58)";https://www.gutenberg.org/ebooks/1906
11757;"The Velveteen Rabbit by Margery Williams Bianco (58)";https://www.gutenberg.org/ebooks/11757
11748;"French Conversation and Composition by Harry Vincent Wann (58)";https://www.gutenberg.org/ebooks/11748
44125;"The Histories of Polybius, Vol. 1 (of 2) by Polybius (58)";https://www.gutenberg.org/ebooks/44125
25589;"He by Andrew Lang and Walter Herries Pollock (58)";https://www.gutenberg.org/ebooks/25589
3189;"Sketches New and Old by Mark Twain (58)";https://www.gutenberg.org/ebooks/3189
24746;"Reise in die Aequinoctial-Gegenden des neuen Continents. Band 2. by Alexander von Humboldt (57)";https://www.gutenberg.org/ebooks/24746
217;"Sons and Lovers by D. H.  Lawrence (57)";https://www.gutenberg.org/ebooks/217
7452;"Autobiography of a Yogi by Paramahansa Yogananda (57)";https://www.gutenberg.org/ebooks/7452
55024;"The Queen of Spades, and other stories by Aleksandr Sergeevich Pushkin (57)";https://www.gutenberg.org/ebooks/55024
1534;"Antony and Cleopatra by William Shakespeare (57)";https://www.gutenberg.org/ebooks/1534
53430;"Principia Ethica by G. E.  Moore (57)";https://www.gutenberg.org/ebooks/53430
2245;"The Taming of the Shrew by William Shakespeare (57)";https://www.gutenberg.org/ebooks/2245
3698;"The Task, and Other Poems by William Cowper (57)";https://www.gutenberg.org/ebooks/3698
2811;"Letters of Pliny by the Younger Pliny (57)";https://www.gutenberg.org/ebooks/2811
66073;"Death in Venice by Thomas Mann (57)";https://www.gutenberg.org/ebooks/66073
69552;"El libro de las tierras vírgenes by Rudyard Kipling (57)";https://www.gutenberg.org/ebooks/69552
19481;""Everyman," with other interludes, including eight miracle plays (57)";https://www.gutenberg.org/ebooks/19481
12750;"The Stolen Bacillus and Other Incidents by H. G.  Wells (57)";https://www.gutenberg.org/ebooks/12750
74790;"De l'assassinat considéré comme un des Beaux-Arts by Thomas De Quincey (57)";https://www.gutenberg.org/ebooks/74790
15679;"The Works of the Right Honourable Edmund Burke, Vol. 03 (of 12) by Edmund Burke (57)";https://www.gutenberg.org/ebooks/15679
61851;"El crimen y el castigo by Fyodor Dostoyevsky (57)";https://www.gutenberg.org/ebooks/61851
63380;"Proverbes sur les femmes, l'amitié, l'amour et le mariage by P.-M.  Quitard (57)";https://www.gutenberg.org/ebooks/63380
5500;"The Advancement of Learning by Francis Bacon (57)";https://www.gutenberg.org/ebooks/5500
36708;"Soeur Thérèse de l'Enfant-Jésus et de la Sainte Face by Saint de Lisieux Thérèse (57)";https://www.gutenberg.org/ebooks/36708
5427;"Emile by Jean-Jacques Rousseau (57)";https://www.gutenberg.org/ebooks/5427
35018;"雲形紋章 by John Meade Falkner (56)";https://www.gutenberg.org/ebooks/35018
50316;"The Fables of La Fontaine by Jean de La Fontaine (56)";https://www.gutenberg.org/ebooks/50316
8775;"Poems by Victor Hugo (56)";https://www.gutenberg.org/ebooks/8775
20862;"Jerry's Reward by Evelyn Snead Barnett (56)";https://www.gutenberg.org/ebooks/20862
233;"Sister Carrie: A Novel by Theodore Dreiser (56)";https://www.gutenberg.org/ebooks/233
43660;"The Vision and Creed of Piers Ploughman, Volume 1 by William Langland (56)";https://www.gutenberg.org/ebooks/43660
2488;"Twenty Thousand Leagues Under the Seas: An Underwater Tour of the World by Jules Verne (56)";https://www.gutenberg.org/ebooks/2488
1021;"The Congo, and Other Poems by Vachel Lindsay (56)";https://www.gutenberg.org/ebooks/1021
12122;"The Monkey's Paw by W. W.  Jacobs (56)";https://www.gutenberg.org/ebooks/12122
20480;"Palmistry for All by Cheiro (56)";https://www.gutenberg.org/ebooks/20480
22400;"Fox's Book of Martyrs by John Foxe (56)";https://www.gutenberg.org/ebooks/22400
544;"Anne's House of Dreams by L. M.  Montgomery (56)";https://www.gutenberg.org/ebooks/544
37499;"Napoleon's Letters to Josephine, 1796-1812 by Emperor of the French Napoleon I (56)";https://www.gutenberg.org/ebooks/37499
3567;"Memoirs of Napoleon Bonaparte — Complete by Louis Antoine Fauvelet de Bourrienne (56)";https://www.gutenberg.org/ebooks/3567
2434;"New Atlantis by Francis Bacon (56)";https://www.gutenberg.org/ebooks/2434
60464;"El árbol de la ciencia: novela by Pío Baroja (56)";https://www.gutenberg.org/ebooks/60464
370;"The Fortunes and Misfortunes of the Famous Moll Flanders by Daniel Defoe (56)";https://www.gutenberg.org/ebooks/370
1635;"Ion by Plato (56)";https://www.gutenberg.org/ebooks/1635
10715;"The Essays of Arthur Schopenhauer; Counsels and Maxims by Arthur Schopenhauer (56)";https://www.gutenberg.org/ebooks/10715
77;"The House of the Seven Gables by Nathaniel Hawthorne (56)";https://www.gutenberg.org/ebooks/77
5307;"The Letters of Wolfgang Amadeus Mozart — Volume 01 by Wolfgang Amadeus Mozart (56)";https://www.gutenberg.org/ebooks/5307
5657;"The Practice of the Presence of God by Brother of the Resurrection Lawrence (56)";https://www.gutenberg.org/ebooks/5657
6378;"Victory: An Island Tale by Joseph Conrad (56)";https://www.gutenberg.org/ebooks/6378
70652;"At the mountains of madness by H. P.  Lovecraft (55)";https://www.gutenberg.org/ebooks/70652
130;"Orthodoxy by G. K.  Chesterton (55)";https://www.gutenberg.org/ebooks/130
49836;"Niebla (Nivola) by Miguel de Unamuno (55)";https://www.gutenberg.org/ebooks/49836
57629;"Lucian's Dialogues prepared for schools by of Samosata Lucian (55)";https://www.gutenberg.org/ebooks/57629
19517;"Le avventure di Pinocchio by Carlo Collodi (55)";https://www.gutenberg.org/ebooks/19517
62704;"The Natural History of Pliny, Volume 6 (of 6) by the Elder Pliny (55)";https://www.gutenberg.org/ebooks/62704
11945;"Essays of Schopenhauer by Arthur Schopenhauer (55)";https://www.gutenberg.org/ebooks/11945
876;"Life in the Iron-Mills; Or, The Korl Woman by Rebecca Harding Davis (55)";https://www.gutenberg.org/ebooks/876
36457;"A Treatise on Meteorological Instruments by Enrico Angelo Lodovico Negretti and Joseph Zambra (55)";https://www.gutenberg.org/ebooks/36457
31;"Plays of Sophocles: Oedipus the King; Oedipus at Colonus; Antigone by Sophocles (55)";https://www.gutenberg.org/ebooks/31
20038;"Frankenstein; Or, The Modern Prometheus by Mary Wollstonecraft Shelley (55)";https://www.gutenberg.org/ebooks/20038
2988;"Mark Twain: A Biography. Complete by Albert Bigelow Paine (55)";https://www.gutenberg.org/ebooks/2988
2445;"Letters on England by Voltaire (54)";https://www.gutenberg.org/ebooks/2445
6923;"The Miser by Molière (54)";https://www.gutenberg.org/ebooks/6923
6053;"Evelina, Or, the History of a Young Lady's Entrance into the World by Fanny Burney (54)";https://www.gutenberg.org/ebooks/6053
2226;"Kim by Rudyard Kipling (54)";https://www.gutenberg.org/ebooks/2226
14314;"Etiquette by Emily Post (54)";https://www.gutenberg.org/ebooks/14314
12753;"The Legends of King Arthur and His Knights by Sir James Knowles and Sir Thomas Malory (54)";https://www.gutenberg.org/ebooks/12753
65903;"Psychology of the Unconscious by C. G.  Jung (54)";https://www.gutenberg.org/ebooks/65903
61168;"The Man in the Brown Suit by Agatha Christie (54)";https://www.gutenberg.org/ebooks/61168
72344;"The decline of the West : by Oswald Spengler (54)";https://www.gutenberg.org/ebooks/72344
139;"The Lost World by Arthur Conan Doyle (54)";https://www.gutenberg.org/ebooks/139
59127;"A Memoir of Robert Blincoe, an Orphan Boy by John Brown (54)";https://www.gutenberg.org/ebooks/59127
48320;"Adventures of Sherlock Holmes by Arthur Conan Doyle (53)";https://www.gutenberg.org/ebooks/48320
598;"Heimskringla; Or, The Chronicle of the Kings of Norway by Snorri Sturluson (53)";https://www.gutenberg.org/ebooks/598
10643;"The World's Greatest Books — Volume 02 — Fiction (53)";https://www.gutenberg.org/ebooks/10643
20872;"The Best Short Stories of 1917, and the Yearbook of the American Short Story (53)";https://www.gutenberg.org/ebooks/20872
48247;"Prayers of the Early Church (53)";https://www.gutenberg.org/ebooks/48247
67799;"The Book of the Courtier by conte Baldassarre Castiglione (53)";https://www.gutenberg.org/ebooks/67799
40682;"Lulu's Library, Volume 1 (of 3) (53)";https://www.gutenberg.org/ebooks/40682
22448;"O Pioneers! by Willa Cather (53)";https://www.gutenberg.org/ebooks/22448
8300;"The Bible, Douay-Rheims, Complete (53)";https://www.gutenberg.org/ebooks/8300
708;"The Princess and the Goblin by George MacDonald (53)";https://www.gutenberg.org/ebooks/708
22951;"Tom Swift and His Aerial Warship; Or, The Naval Terror of the Seas by Victor Appleton (53)";https://www.gutenberg.org/ebooks/22951
28488;"Tartuffe; Or, The Hypocrite by Molière (53)";https://www.gutenberg.org/ebooks/28488
51060;"The Narrative of Arthur Gordon Pym of Nantucket by Edgar Allan Poe (53)";https://www.gutenberg.org/ebooks/51060
10940;"Manners, Customs, and Dress During the Middle Ages and During the Renaissance Period by P. L. Jacob (53)";https://www.gutenberg.org/ebooks/10940
14417;"The Agamemnon of Aeschylus by Aeschylus (53)";https://www.gutenberg.org/ebooks/14417
11136;"A Discourse Upon the Origin and the Foundation of the Inequality Among Mankind by Rousseau (53)";https://www.gutenberg.org/ebooks/11136
20604;"Christmas Poetry and Hymn Collection by Various (53)";https://www.gutenberg.org/ebooks/20604
1155;"The Secret Adversary by Agatha Christie (53)";https://www.gutenberg.org/ebooks/1155
20916;"The Arabian Nights: Their Best-known Tales (52)";https://www.gutenberg.org/ebooks/20916
15076;"Some Principles of Maritime Strategy by Julian Stafford Corbett (52)";https://www.gutenberg.org/ebooks/15076
479;"Little Lord Fauntleroy by Frances Hodgson Burnett (52)";https://www.gutenberg.org/ebooks/479
23077;"Jane Eyre by Charlotte Brontë (52)";https://www.gutenberg.org/ebooks/23077
26038;"Drawings and Pharmacy in Al-Zahrawi's 10th-Century Surgical Treatise by Sami Khalaf Hamarneh (52)";https://www.gutenberg.org/ebooks/26038
9603;"Hung Lou Meng, or, the Dream of the Red Chamber, a Chinese Novel, Book I by Xueqin Cao (52)";https://www.gutenberg.org/ebooks/9603
26272;"The Spy by James Fenimore Cooper (52)";https://www.gutenberg.org/ebooks/26272
